{
  "id": "escritura-ef-5-25",
  "tipo": "Escritura",
  "titulo_fuente": "Carta a los Efesios",
  "autor": "San Pablo",
  "referencia_exacta": "Ef 5,25",
  "enlace": "https://www.vatican.va/archive/ESL0506/__PYF.HTM",
  "fragmento_textual": "Maridos, amad a vuestras mujeres, así como Cristo amó a la Iglesia y se entregó a sí mismo por ella.",
  "traduccion": "POR CONFIRMAR — semilla orientativa. Recomendado: Biblia Torres Amat (católica, dominio público).",
  "afirmacion_que_sostiene": "La 'cabeza' del hogar se define por la entrega sacrificial de Cristo, no por el mando. El modelo del esposo es Cristo que se entrega, no el que domina.",
  "clasificacion_doctrinal": { "nivel": 1, "etiqueta": "Sagrada Escritura" },
  "contexto": "Clave para todo el tema 'autoridad del esposo / cabeza del hogar': el versículo inmediatamente siguiente al mandato de sujeción reorienta todo hacia el amor oblativo. Citar el v. 25 SIEMPRE que se toque la autoridad conyugal, para no deformarla en dominación. Tema sensible: bandera de revisión humana (ver manual/03).",
  "temas_asociados": ["cabeza-del-hogar", "matrimonio", "autoridad-como-servicio"],
  "pilares": ["Familia", "Virtud"],
  "santos_asociados": [],
  "verificado": false,
  "nota_verificacion": "Confirmar verbatim y traducción. Tema sensible: usar con el encuadre de servicio."
}
