{
  "id": "escritura-1cor-16-13",
  "tipo": "Escritura",
  "titulo_fuente": "Primera carta a los Corintios",
  "autor": "San Pablo",
  "referencia_exacta": "1 Cor 16,13",
  "enlace": "https://www.vatican.va/archive/ESL0506/__PXK.HTM",
  "fragmento_textual": "Velad, estad firmes en la fe, portaos varonilmente y sed fuertes.",
  "traduccion": "POR CONFIRMAR — semilla orientativa. Recomendado: Biblia Torres Amat (católica, dominio público). Definir versión de referencia del proyecto.",
  "afirmacion_que_sostiene": "La firmeza en la fe y la fortaleza viril son un mandato apostólico, no una estética. Es el versículo emblema de la cuenta.",
  "clasificacion_doctrinal": { "nivel": 1, "etiqueta": "Sagrada Escritura" },
  "contexto": "Exhortación final de Pablo a la comunidad de Corinto. 'Portarse varonilmente' traduce el griego andrízesthe: conducirse con hombría/valentía en la fe. No es un llamado a la dureza sino a la constancia valiente.",
  "temas_asociados": ["masculinidad-cristiana", "fortaleza", "fe-firme"],
  "pilares": ["Fe", "Virtud"],
  "santos_asociados": [],
  "verificado": false,
  "nota_verificacion": "Confirmar verbatim y traducción de referencia antes de citar en producción."
}
